{
  "actions": [
    {
      "op": "read",
      "resource": "permitted/customer_a.json",
      "seq": 1
    },
    {
      "op": "read",
      "resource": "permitted/customer_b.json",
      "seq": 2
    },
    {
      "content": {
        "currency": "USD",
        "source_ids": [
          "customer_a",
          "customer_b"
        ],
        "total_due": 342
      },
      "op": "write",
      "resource": "output/result.json",
      "seq": 3
    }
  ],
  "final_output": {
    "currency": "USD",
    "source_ids": [
      "customer_a",
      "customer_b"
    ],
    "total_due": 342
  },
  "task_id": "AS-001",
  "task_version": "1.0.0"
}
